{
  "$schema": "https://json-schema.org/draft/2020-12/schema",
  "$id": "https://sc-mv-dmer.local/schemas/e1_0_mert_upstream_binding.schema.json",
  "title": "E10MertUpstreamBindingQualification v1.0",
  "type": "object",
  "additionalProperties": false,
  "required": ["schema_version", "qualification_id", "git_commit", "git_dirty", "repository_id", "revision", "manifest_logical_path", "manifest_file_sha256", "inventory_logical_path", "inventory_file_sha256", "predecessor_qualification", "predecessor_qualification_sha256", "semantic_upstream_identity", "snapshot_aggregate_sha256", "custom_code_aggregate_sha256", "canonical_weight_sha256", "criteria", "e1_0_verdict", "e1_1_readiness", "model_instantiated", "mert_forward_executed", "frame_rate_derived", "t_raw_derived", "timesnet_derived", "binning_2hz_executed", "rg_01_attempted", "qualification_sha256"],
  "$defs": {"sha256": {"type": "string", "pattern": "^[0-9a-f]{64}$"}},
  "properties": {
    "schema_version": {"const": "1.0"},
    "qualification_id": {"const": "E1-0-MERT-UPSTREAM-BINDING-v1"},
    "git_commit": {"type": "string", "minLength": 7},
    "git_dirty": {"const": false},
    "repository_id": {"const": "m-a-p/MERT-v1-95M"},
    "revision": {"const": "12af15fef9d0ac838c3f475bfbbf26d2060dd4f5"},
    "manifest_logical_path": {"type": "string", "minLength": 1},
    "manifest_file_sha256": {"$ref": "#/$defs/sha256"},
    "inventory_logical_path": {"type": "string", "minLength": 1},
    "inventory_file_sha256": {"$ref": "#/$defs/sha256"},
    "predecessor_qualification": {"type": "string", "minLength": 1},
    "predecessor_qualification_sha256": {"$ref": "#/$defs/sha256"},
    "semantic_upstream_identity": {"$ref": "#/$defs/sha256"},
    "snapshot_aggregate_sha256": {"$ref": "#/$defs/sha256"},
    "custom_code_aggregate_sha256": {"$ref": "#/$defs/sha256"},
    "canonical_weight_sha256": {"$ref": "#/$defs/sha256"},
    "criteria": {"type": "object", "minProperties": 1, "additionalProperties": {"const": true}},
    "e1_0_verdict": {"const": "PASS"},
    "e1_1_readiness": {"const": "READY"},
    "model_instantiated": {"const": false},
    "mert_forward_executed": {"const": false},
    "frame_rate_derived": {"const": false},
    "t_raw_derived": {"const": false},
    "timesnet_derived": {"const": false},
    "binning_2hz_executed": {"const": false},
    "rg_01_attempted": {"const": false},
    "qualification_sha256": {"$ref": "#/$defs/sha256"}
  }
}
