{"binning_2hz_executed":false,"canonical_weight_sha256":"a2b8b747f72c06e0595aeae41ae5473f4364938c6b39b2c58be38c48e6bd3fcd","criteria":{"all_local_sha256_registered":true,"all_required_bytes_present":true,"canonical_transformers_weight_identified":true,"custom_model_code_pinned":true,"exact_revision_verified":true,"local_files_only_required":true,"processor_identity_pinned":true,"snapshot_aggregate_valid":true},"custom_code_aggregate_sha256":"6f5980e11c3968aba34887379c5abf2c63ed5d3536e8996b721f797f7b29799c","e1_0_verdict":"PASS","e1_1_readiness":"READY","frame_rate_derived":false,"git_commit":"b7f3e3696dc0d7582524bdc9122c84387eaaab16","git_dirty":false,"inventory_file_sha256":"0d2b0bbfd1c63e87979967df8ba7b3f3f1b70b0bc73b8a3000a054835be6650e","inventory_logical_path":"reports/preflight/mert-pinned-snapshot-inventory.json","manifest_file_sha256":"0c9ebf2cdb148dfe392bac987f41c483f3fd0aa9a23e41b6810ed0daf5d20844","manifest_logical_path":"manifests/upstream/mert-v1-95m-primary-v1.json","mert_forward_executed":false,"model_instantiated":false,"predecessor_qualification":"evidence/qualifications/step-0-minimum-bootstrap-v4.json","predecessor_qualification_sha256":"6e19d86063e0632566cb71e48752f2ed3f8e60a1ce442cba9594dad6cab739ca","qualification_id":"E1-0-MERT-UPSTREAM-BINDING-v1","qualification_sha256":"a7cfe7e4bc7608fbef0b4a8cfaa4e8c7fe2b1ea0f298192c546bf5c88353952c","repository_id":"m-a-p/MERT-v1-95M","revision":"12af15fef9d0ac838c3f475bfbbf26d2060dd4f5","rg_01_attempted":false,"schema_version":"1.0","semantic_upstream_identity":"341484e496d82b55422a638b10ad24ce2e5d1fa507627dad1c849049c9f7c39d","snapshot_aggregate_sha256":"07269a149bcedb98f6c0cd9bc11719c4e0571f06e4fe41599536cd180812b80c","t_raw_derived":false,"timesnet_derived":false}
